0:00 = 0000
0:02 = 0e8e
0:04 = 0000
0:06 = 0e8e
0:08 = 0000
0:0a = 000e
0:0c = bfbf
0:0e = bfbf
0:10 = 9f9f
0:12 = bfbf
0:14 = bfbf
0:16 = bfbf
0:18 = 0888
0:1a = 0000
0:1c = 0808
0:1e = 8000
0:20 = 0000
0:22 = 0000
0:24 = 0000
0:26 = 0f0f
0:28 = 0809
0:2a = 7809
0:2c = bb80
0:2e = bb80
0:30 = bb80
0:32 = bb80
0:34 = bb80
0:36 = 0000
0:38 = 0000
0:3a = 0000
0:3c = 0000
0:3e = 0000
0:40 = 0000
0:42 = 0000
0:44 = 0000
0:46 = 0000
0:48 = 0000
0:4a = 0000
0:4c = 0000
0:4e = 0000
0:50 = 0000
0:52 = 0000
0:54 = 0000
0:56 = 0000
0:58 = 0000
0:5a = 0000
0:5c = 0000
0:5e = 0000
0:60 = 0000
0:62 = 0000
0:64 = 0000
0:66 = 0000
0:68 = 0000
0:6a = 0000
0:6c = 0000
0:6e = 0000
0:70 = 0000
0:72 = 0000
0:74 = 0000
0:76 = 0000
0:78 = 0000
0:7a = 0000
0:7c = 8384
0:7e = 7600
